[
  {
    "id": "LU",
    "code": "LU",
    "names": {
      "zh": "手太阴肺经",
      "pinyin": "Shǒu Tàiyīn Fèi Jīng",
      "es": "Pulmón",
      "en": "Lung"
    },
    "element": "metal",
    "polaridad": "yin",
    "clockHour": 3,
    "pointCount": 11,
    "pointCodes": [
      "LU1",
      "LU2",
      "LU3",
      "LU4",
      "LU5",
      "LU6",
      "LU7",
      "LU8",
      "LU9",
      "LU10",
      "LU11"
    ],
    "pathAnchors": [
      {
        "x": 0.07,
        "y": 0.4,
        "z": 0.08
      },
      {
        "x": 0.16,
        "y": 0.54,
        "z": 0.03
      },
      {
        "x": 0.32,
        "y": 0.36,
        "z": 0.03
      },
      {
        "x": 0.44,
        "y": 0.22,
        "z": 0.04
      },
      {
        "x": 0.5,
        "y": 0.14,
        "z": 0.06
      }
    ],
    "flow": "chest-to-hand",
    "laterality": "bilateral",
    "color": "#3D4A54"
  },
  {
    "id": "LI",
    "code": "LI",
    "names": {
      "zh": "手阳明大肠经",
      "pinyin": "Shǒu Yángmíng Dàcháng Jīng",
      "es": "Intestino Grueso",
      "en": "Large Intestine"
    },
    "element": "metal",
    "polaridad": "yang",
    "clockHour": 5,
    "pointCount": 20,
    "pointCodes": [
      "LI1",
      "LI2",
      "LI3",
      "LI4",
      "LI5",
      "LI6",
      "LI7",
      "LI8",
      "LI9",
      "LI10",
      "LI11",
      "LI12",
      "LI13",
      "LI14",
      "LI15",
      "LI16",
      "LI17",
      "LI18",
      "LI19",
      "LI20"
    ],
    "pathAnchors": [
      {
        "x": 0.5,
        "y": 0.12,
        "z": 0.05
      },
      {
        "x": 0.47,
        "y": 0.16,
        "z": 0.05
      },
      {
        "x": 0.34,
        "y": 0.38,
        "z": 0.04
      },
      {
        "x": 0.18,
        "y": 0.56,
        "z": 0.02
      },
      {
        "x": 0.08,
        "y": 0.68,
        "z": 0.06
      },
      {
        "x": 0.02,
        "y": 0.76,
        "z": 0.1
      }
    ],
    "flow": "hand-to-head",
    "laterality": "bilateral",
    "color": "#3D4A54"
  },
  {
    "id": "ST",
    "code": "ST",
    "names": {
      "zh": "足阳明胃经",
      "pinyin": "Zú Yángmíng Wèi Jīng",
      "es": "Estómago",
      "en": "Stomach"
    },
    "element": "earth",
    "polaridad": "yang",
    "clockHour": 7,
    "pointCount": 45,
    "pointCodes": [
      "ST1",
      "ST2",
      "ST3",
      "ST4",
      "ST5",
      "ST6",
      "ST7",
      "ST8",
      "ST9",
      "ST10",
      "ST11",
      "ST12",
      "ST13",
      "ST14",
      "ST15",
      "ST16",
      "ST17",
      "ST18",
      "ST19",
      "ST20",
      "ST21",
      "ST22",
      "ST23",
      "ST24",
      "ST25",
      "ST26",
      "ST27",
      "ST28",
      "ST29",
      "ST30",
      "ST31",
      "ST32",
      "ST33",
      "ST34",
      "ST35",
      "ST36",
      "ST37",
      "ST38",
      "ST39",
      "ST40",
      "ST41",
      "ST42",
      "ST43",
      "ST44",
      "ST45"
    ],
    "pathAnchors": [
      {
        "x": 0.04,
        "y": 0.74,
        "z": 0.09
      },
      {
        "x": 0.05,
        "y": 0.66,
        "z": 0.08
      },
      {
        "x": 0.08,
        "y": 0.52,
        "z": 0.08
      },
      {
        "x": 0.1,
        "y": 0.32,
        "z": 0.1
      },
      {
        "x": 0.08,
        "y": 0.08,
        "z": 0.1
      },
      {
        "x": 0.1,
        "y": -0.2,
        "z": 0.08
      },
      {
        "x": 0.13,
        "y": -0.52,
        "z": 0.07
      },
      {
        "x": 0.1,
        "y": -0.78,
        "z": 0.07
      },
      {
        "x": 0.08,
        "y": -0.9,
        "z": 0.11
      }
    ],
    "flow": "head-to-foot",
    "laterality": "bilateral",
    "color": "#5F3D0C"
  },
  {
    "id": "SP",
    "code": "SP",
    "names": {
      "zh": "足太阴脾经",
      "pinyin": "Zú Tàiyīn Pí Jīng",
      "es": "Bazo",
      "en": "Spleen"
    },
    "element": "earth",
    "polaridad": "yin",
    "clockHour": 9,
    "pointCount": 21,
    "pointCodes": [
      "SP1",
      "SP2",
      "SP3",
      "SP4",
      "SP5",
      "SP6",
      "SP7",
      "SP8",
      "SP9",
      "SP10",
      "SP11",
      "SP12",
      "SP13",
      "SP14",
      "SP15",
      "SP16",
      "SP17",
      "SP18",
      "SP19",
      "SP20",
      "SP21"
    ],
    "pathAnchors": [
      {
        "x": 0.04,
        "y": -0.9,
        "z": 0.08
      },
      {
        "x": 0.08,
        "y": -0.7,
        "z": 0
      },
      {
        "x": 0.08,
        "y": -0.42,
        "z": 0.02
      },
      {
        "x": 0.09,
        "y": -0.12,
        "z": 0.04
      },
      {
        "x": 0.08,
        "y": 0.04,
        "z": 0.07
      },
      {
        "x": 0.16,
        "y": 0.28,
        "z": 0
      }
    ],
    "flow": "foot-to-chest",
    "laterality": "bilateral",
    "color": "#5F3D0C"
  },
  {
    "id": "HT",
    "code": "HT",
    "names": {
      "zh": "手少阴心经",
      "pinyin": "Shǒu Shǎoyīn Xīn Jīng",
      "es": "Corazón",
      "en": "Heart"
    },
    "element": "fire",
    "polaridad": "yin",
    "clockHour": 11,
    "pointCount": 9,
    "pointCodes": [
      "HT1",
      "HT2",
      "HT3",
      "HT4",
      "HT5",
      "HT6",
      "HT7",
      "HT8",
      "HT9"
    ],
    "pathAnchors": [
      {
        "x": 0.12,
        "y": 0.42,
        "z": 0.02
      },
      {
        "x": 0.28,
        "y": 0.38,
        "z": -0.01
      },
      {
        "x": 0.43,
        "y": 0.19,
        "z": -0.01
      }
    ],
    "flow": "chest-to-hand",
    "laterality": "bilateral",
    "color": "#8A231D"
  },
  {
    "id": "SI",
    "code": "SI",
    "names": {
      "zh": "手太阳小肠经",
      "pinyin": "Shǒu Tàiyáng Xiǎocháng Jīng",
      "es": "Intestino Delgado",
      "en": "Small Intestine"
    },
    "element": "fire",
    "polaridad": "yang",
    "clockHour": 13,
    "pointCount": 19,
    "pointCodes": [
      "SI1",
      "SI2",
      "SI3",
      "SI4",
      "SI5",
      "SI6",
      "SI7",
      "SI8",
      "SI9",
      "SI10",
      "SI11",
      "SI12",
      "SI13",
      "SI14",
      "SI15",
      "SI16",
      "SI17",
      "SI18",
      "SI19"
    ],
    "pathAnchors": [
      {
        "x": 0.47,
        "y": 0.14,
        "z": -0.03
      },
      {
        "x": 0.44,
        "y": 0.2,
        "z": -0.04
      },
      {
        "x": 0.32,
        "y": 0.38,
        "z": -0.04
      },
      {
        "x": 0.12,
        "y": 0.52,
        "z": -0.08
      },
      {
        "x": 0.08,
        "y": 0.72,
        "z": 0.08
      }
    ],
    "flow": "hand-to-head",
    "laterality": "bilateral",
    "color": "#8A231D"
  },
  {
    "id": "BL",
    "code": "BL",
    "names": {
      "zh": "足太阳膀胱经",
      "pinyin": "Zú Tàiyáng Pángguāng Jīng",
      "es": "Vejiga",
      "en": "Bladder"
    },
    "element": "water",
    "polaridad": "yang",
    "clockHour": 15,
    "pointCount": 67,
    "pointCodes": [
      "BL1",
      "BL2",
      "BL3",
      "BL4",
      "BL5",
      "BL6",
      "BL7",
      "BL8",
      "BL9",
      "BL10",
      "BL11",
      "BL12",
      "BL13",
      "BL14",
      "BL15",
      "BL16",
      "BL17",
      "BL18",
      "BL19",
      "BL20",
      "BL21",
      "BL22",
      "BL23",
      "BL24",
      "BL25",
      "BL26",
      "BL27",
      "BL28",
      "BL29",
      "BL30",
      "BL31",
      "BL32",
      "BL33",
      "BL34",
      "BL35",
      "BL36",
      "BL37",
      "BL38",
      "BL39",
      "BL40",
      "BL41",
      "BL42",
      "BL43",
      "BL44",
      "BL45",
      "BL46",
      "BL47",
      "BL48",
      "BL49",
      "BL50",
      "BL51",
      "BL52",
      "BL53",
      "BL54",
      "BL55",
      "BL56",
      "BL57",
      "BL58",
      "BL59",
      "BL60",
      "BL61",
      "BL62",
      "BL63",
      "BL64",
      "BL65",
      "BL66",
      "BL67"
    ],
    "pathAnchors": [
      {
        "x": 0.03,
        "y": 0.76,
        "z": 0.09
      },
      {
        "x": 0.02,
        "y": 0.9,
        "z": 0
      },
      {
        "x": 0.04,
        "y": 0.68,
        "z": -0.08
      },
      {
        "x": 0.045,
        "y": 0.1,
        "z": -0.08
      },
      {
        "x": 0.11,
        "y": -0.4,
        "z": -0.05
      },
      {
        "x": 0.1,
        "y": -0.78,
        "z": -0.03
      },
      {
        "x": 0.08,
        "y": -0.9,
        "z": -0.02
      }
    ],
    "flow": "head-to-foot",
    "laterality": "bilateral",
    "color": "#1F3F6E"
  },
  {
    "id": "KI",
    "code": "KI",
    "names": {
      "zh": "足少阴肾经",
      "pinyin": "Zú Shǎoyīn Shèn Jīng",
      "es": "Riñón",
      "en": "Kidney"
    },
    "element": "water",
    "polaridad": "yin",
    "clockHour": 17,
    "pointCount": 27,
    "pointCodes": [
      "KI1",
      "KI2",
      "KI3",
      "KI4",
      "KI5",
      "KI6",
      "KI7",
      "KI8",
      "KI9",
      "KI10",
      "KI11",
      "KI12",
      "KI13",
      "KI14",
      "KI15",
      "KI16",
      "KI17",
      "KI18",
      "KI19",
      "KI20",
      "KI21",
      "KI22",
      "KI23",
      "KI24",
      "KI25",
      "KI26",
      "KI27"
    ],
    "pathAnchors": [
      {
        "x": 0.04,
        "y": -0.92,
        "z": 0.02
      },
      {
        "x": 0.08,
        "y": -0.78,
        "z": -0.03
      },
      {
        "x": 0.08,
        "y": -0.42,
        "z": 0
      },
      {
        "x": 0.04,
        "y": 0.08,
        "z": 0.08
      },
      {
        "x": 0.04,
        "y": 0.48,
        "z": 0.08
      }
    ],
    "flow": "foot-to-chest",
    "laterality": "bilateral",
    "color": "#1F3F6E"
  },
  {
    "id": "PC",
    "code": "PC",
    "names": {
      "zh": "手厥阴心包经",
      "pinyin": "Shǒu Juéyīn Xīnbāo Jīng",
      "es": "Pericardio",
      "en": "Pericardium"
    },
    "element": "fire",
    "polaridad": "yin",
    "clockHour": 19,
    "pointCount": 9,
    "pointCodes": [
      "PC1",
      "PC2",
      "PC3",
      "PC4",
      "PC5",
      "PC6",
      "PC7",
      "PC8",
      "PC9"
    ],
    "pathAnchors": [